{
  "$schema": "../../schemas/theme-metadata.schema.json",
  "name": "Midnight",
  "slug": "midnight",
  "description": "A clean midnight theme",
  "latestVersion": "1.1.0",
  "versions": [
    {
      "version": "1.0.0",
      "file": "files/1.0.0.json",
      "checksumSha256": "bbf4f6c3414b8ea62be09d446b35a5a7a58ac245e7bda4eb20dbf8094a8e8f9e"
    },
    {
      "version": "1.1.0",
      "file": "files/1.1.0.json",
      "changelog": "Changes",
      "checksumSha256": "bbf4f6c3414b8ea62be09d446b35a5a7a58ac245e7bda4eb20dbf8094a8e8f9e"
    }
  ]
}
