{
  "$schema": "../../schemas/theme-metadata.schema.json",
  "name": "Termy",
  "slug": "termy",
  "description": "The termy theme ",
  "latestVersion": "0.2.0",
  "versions": [
    {
      "version": "0.1.0",
      "file": "files/0.1.0.json",
      "checksumSha256": "b249fce2fbd077c917a128e1ab345f4d0b5ab9f1f40d5cefa3fa31484a811e38"
    },
    {
      "version": "0.2.0",
      "file": "files/0.2.0.json",
      "changelog": "Rebrand palette: pure black #09090B + lime #A7E9A3 (matches termy.sh logo)",
      "checksumSha256": "e95cc7505b811fcabf3294cf8ec1d2bda0115287dd34e3dc1261c62294454b11"
    }
  ]
}
